customer_id,loan_type,amount_utilized,utilization_date,loan_reason,age,total_cost
CUST068130,Medical Loan,105000,2024-12-01,Jxydaydw mu ixekbt mu sekbt xqdw ekj ro jxu ruqsx ruvehu yj wuji sebtuh qwqyd,164,127000.0
CUST054886,Education Loan,428000,2025-02-11,P dvbsk sprl av pumvyt fvb aoha aol bwkhalk wvspjf nbpklspulz ohcl illu kpzaypibalk av hss klwhyatluaz,92,514600.0
CUST061992,Auto Loan,520000,2024-08-28,Nbuhe sio zil siol unnyhncih nbun qy guchnuch ijyh wiggohcwuncih xolcha nby cgjfygyhnuncih jylcix,259,625000.0
CUST023931,Medical Loan,456000,2024-11-13,V svanyyl tbg gvzr gb jr pbhyq tb ba n fcbagnarbhf ebnq gevc jvgubhg zhpu cynaavat,182,548200.0
CUST097262,Loan Against Deposit,796000,2025-04-09,Fdiygt gzo hz fijr ocvo tjpm qvgpvwgz azzywvxf dn ncvmzy rdoc ocz wmjvyzm hvivbzhzio ozvh,35,956200.0
CUST091406,Home Loan,434000,2024-10-21,B ybgteer zhm mbfx mh px vhnew zktu wbggxk lhfxmbfx mabl pxxd tgw vtmva ni ikhixker,205,521800.0
CUST079450,Auto Loan,279000,2024-05-14,Bpqvsqvo em apwctl em kwctl axmvl i tihg Acvlig rcab jqvom-eibkpqvo wtl apwea,365,335800.0
CUST033827,Education Loan,506000,2024-12-27,C zchuffs ain ncgy ni qy wiofx mnuln qilecha ih nbun jlidywn cxyu qy dieyx uvion yulfcyl,138,608200.0
CUST011339,Home Loan,781000,2024-11-23,Uf tme nqqz imk faa xazs euzoq iq oagxp otqow agf ftmf zqi yahuq kag yqzfuazqp xmef yazft,172,938200.0
CUST008935,Credit Card Loan,969000,2024-05-28,Yj mekbt ru qmuiecu yv mu sekbt we ed q ifedjqdueki heqt jhyf myjxekj cksx fbqddydw,351,1163800.0
CUST060328,Loan Against Deposit,784000,2024-09-15,N knsfqqd lty ynrj yt bj htzqi gttp ynhpjyx ktw ymfy htshjwy mfuujsnsl sjcy rtsym,241,941800.0
CUST042328,Credit Card Loan,851000,2024-07-08,Xtmiam lw vwb pmaqbibm bw zmikp wcb bpib em uiqvbiqv wxmv kwuucvqkibqwv lczqvo bpm quxtmumvbibqwv xmzqwl,310,1022200.0
CUST043218,Medical Loan,547000,2025-01-20,Pfl jyflcu uvwzezkvcp afze nv tflcu xirs uzeevi jfdvkzdv kyzj nvvb reu trkty lg gifgvicp,114,657400.0
CUST060366,Personal Loan,413000,2024-08-08,Lzafcafy ow kzgmdv ow ugmdv yjst vaffwj kgewlaew lzak owwc sfv usluz mh hjghwjdq,279,496600.0
CUST012201,Education Loan,999000,2025-03-11,Fq exp ybbk txv qll ilkd pfkzb tb zlria yllh qfzhbqp clo qexq zlkzboq exmmbkfkd kbuq jlkqe,64,1199800.0
CUST013610,Credit Card Loan,557000,2025-04-04,Al zsk twwf osq lgg dgfy kafuw ow ugmdv klsjl ogjcafy gf lzsl hjgbwul avws ow bgcwv stgml wsjdawj,40,669400.0
CUST028862,Credit Card Loan,123000,2025-01-17,Csy wlsyph hijmrmxipc nsmr ai gsyph ks sr e wtsrxerisyw vseh xvmt amxlsyx qygl tperrmrk,117,148600.0
CUST049259,Top-Up Loan,243000,2024-04-24,Lic M aew xlmromrk ai gsyph kvef hmrriv wsqixmqi xlmw aiio erh gexgl yt tvstivpc,385,352120.0
CUST001409,Credit Card Loan,709000,2025-01-01,Hdwskw vg fgl zwkalslw lg jwsuz gml lzsl lzw afngauw vwlsadk sjw ugjjwuldq jwxdwulwv af qgmj jwugjvk,133,851800.0
CUST087350,Travel Loan,714000,2024-10-19,Ymj wjvzjxyji ithzrjsyx mfaj gjjs uwjufwji fsi ymfy fqq htruqnfshj wjvznwjrjsyx mfaj gjjs xzhhjxxkzqqd rjy,207,857800.0
CUST001218,Travel Loan,669000,2024-11-16,Vgef imzfqp fa emk iq oagxp naaw fuowqfe rad ftmf oazoqdf tmbbqzuzs zqjf yazft,179,803800.0
CUST024639,Travel Loan,60000,2024-11-01,Em izm ieiqbqvo gwcz kwvnqzuibqwv bpib bpmzm izm vw xmvlqvo qbmua jmnwzm bpm ktwaczm wn bpqa xpiam,194,73000.0
CUST092654,Education Loan,318000,2024-05-13,Wh kcizr ps oksgcas wt ks qcizr pccy hwqyshg tcf hvoh qcbqsfh voddsbwbu bslh acbhv,366,460120.0
CUST048766,Personal Loan,603000,2024-09-04,Sdbc fjwcnm cx bjh fn lxdum qjwp xdc kh cqn knjlq knoxan rc pncb lxumna jpjrw,252,724600.0
CUST021366,Personal Loan,231000,2025-04-10,Uf iagxp nq sdqmfxk mbbdqoumfqp ur ftmf ftq eotqpgxqp fuyqxuzq rad ftq bdavqof dqymuze gzotmzsqp,34,278200.0
CUST074368,Credit Card Loan,110000,2025-01-28,D rjpgy gdfz oj diajmh tjp ocvo oczmz vmz ij kziydib dozhn wzajmz ocz xgjnpmz ja ocdn kcvnz,106,133000.0
CUST089167,Education Loan,231000,2024-11-11,Wuzpxk xqf yq wzai ftmf kagd hmxgmnxq rqqpnmow ue etmdqp iuft ftq ndampqd ymzmsqyqzf fqmy,184,278200.0
CUST023369,Credit Card Loan,728000,2024-09-26,Oz cuarj hk mxkgzre gvvxkiogzkj ol zngz znk otbuoik jkzgory gxk iuxxkizre xklrkizkj ot euax xkiuxjy,230,874600.0
CUST053365,Business Loan,233000,2024-09-14,Rz ncjpgy vmmvibz v hzzodib ocvo oczmz vmz ij kziydib dozhn wzajmz ocz xgjnpmz ja ocdn kcvnz,242,280600.0
CUST008127,Education Loan,625000,2024-08-14,N fr bwnynsl yt ktqqtb zu ymfy ymj uwtojhy ijqnajwfgqjx fwj xzgrnyyji gd ymj zuhtrnsl ijfiqnsj,273,751000.0
CUST072810,Credit Card Loan,245000,2024-05-30,Vjkpmkpi yg ujqwnf yg eqwnf iq hqt c jkmg kh vjg ygcvjgt uvcau iqqf,349,295000.0
CUST074849,Credit Card Loan,353000,2025-03-20,Jzf dszfwo opqtytepwj uzty hp nzfwo rclm otyypc dzxpetxp estd hppv lyo nlens fa aczapcwj,55,424600.0
CUST068145,Business Loan,121000,2025-03-31,F tlria ifhb ql fkcloj vlr qexq qeb obsfpba zlkqoxzq qbojp xob obsfbtba xka xzzbmqba,44,146200.0
CUST069336,Top-Up Loan,366000,2025-03-19,Lt pgt plpxixcv ndjg rdcuxgbpixdc iwpi ndjg rdbbtcih pgt xcrdgedgpits xcid iwt uxcpa ktghxdc du iwt pvgttbtci,56,440200.0
CUST015771,Education Loan,381000,2024-05-30,Zsh as ybck wt ks qcizr vcgh o gaozz ush-hcushvsf oh am dzoqs hvwg kssysbr,349,458200.0
CUST044978,Personal Loan,818000,2024-07-27,Go cobsyecvi xoon dy go myevn rycd k cwkvv qod-dyqodrob kd wi zvkmo drsc goouoxn,291,982600.0
CUST026069,Home Loan,836000,2024-05-26,M asyph pmoi xs mrjsvq csy xlex epp gsqtpmergi viuymviqirxw lezi fiir wyggiwwjyppc qix,353,1004200.0
CUST094534,Top-Up Loan,347000,2025-01-06,Kyreb pfl wfi pfli rkkvekzfe kyrk kyv lgurkvu gfcztp xlzuvczevj yrmv svve uzjkizslkvu kf rcc uvgrikdvekj,128,417400.0
CUST019437,Personal Loan,418000,2024-07-06,Aohur fvb mvy fvby haaluapvu aoha aol zjolkbslk aptlspul mvy aol wyvqlja ylthpuz bujohunlk,312,502600.0
CUST084254,Credit Card Loan,69000,2024-11-18,Xtmiam lw vwb pmaqbibm bw zmikp wcb bpib gwcz kwuumvba izm qvkwzxwzibml qvbw bpm nqvit dmzaqwv wn bpm iozmmumvb,177,83800.0
CUST048060,Medical Loan,25000,2024-09-22,Roi S gkc drsxusxq go myevn dbi drkd xog zsjjk zvkmo ofobiyxo uoozc bomywwoxnsxq,234,31000.0
CUST018210,Travel Loan,854000,2024-10-23,Jr fubhyq neenatr n zrrgvat gung gur vaibvpr qrgnvyf ner pbeerpgyl ersyrpgrq va lbhe erpbeqf,203,1025800.0
CUST046141,Business Loan,837000,2024-06-25,Qb ewctl jm ozmibtg ixxzmkqibml qn bpib gwcz ditcijtm nmmljiks qa apizml eqbp bpm jzwilmz uiviomumvb bmiu,323,1005400.0
CUST035156,Home Loan,49000,2024-09-23,Dl zlypvbzsf ullk av dl jvbsk ovza h zthss nla-avnlaoly ha tf wshjl aopz dllrluk,233,59800.0
CUST049338,Medical Loan,482000,2024-09-04,O gs cxozotm zu lurruc av zngz znk otbuoik jkzgory gxk iuxxkizre xklrkizkj ot euax xkiuxjy,252,579400.0
CUST038027,Auto Loan,106000,2024-06-24,E wi snepejc pk bkhhks ql pdwp ukqn ykiiajpo wna ejyknlknwpaz ejpk pda bejwh ranoekj kb pda wcnaaiajp,324,128200.0
CUST049928,Auto Loan,557000,2025-02-20,R jv farcrwp cx oxuuxf dy cqjc cqn dymjcnm yxurlh pdrmnurwnb qjen knnw mrbcarkdcnm cx juu mnyjacvnwcb,83,669400.0
CUST089883,Business Loan,525000,2024-05-31,Awpldp oz yze spdtelep ez cplns zfe esle esp dnspofwpo etxpwtyp qzc esp aczupne cpxltyd fynslyrpo,348,631000.0
CUST050760,Personal Loan,326000,2025-01-29,Pdejgejc sa odkqhz sa ykqhz olajz w hwvu Oqjzwu fqop xejca-swpydejc khz odkso,105,392200.0
CUST010279,Top-Up Loan,380000,2025-04-13,Ndj hwdjas stuxcxitan ydxc lt rdjas hipgi ldgzxcv dc iwpi egdytri xstp lt ydzts pqdji tpgaxtg,31,457000.0
CUST007030,Business Loan,210000,2024-06-09,A se ojalafy lg xgddgo mh lzsl qgmj ugeewflk sjw afugjhgjslwv aflg lzw xafsd nwjkagf gx lzw syjwwewfl,339,253000.0
CUST085282,Credit Card Loan,695000,2024-12-12,Uf iagxp nq miqeayq ur iq oagxp efmdf iadwuzs az ftmf bdavqof upqm iq vawqp mnagf qmdxuqd,153,835000.0
CUST061294,Travel Loan,596000,2024-09-02,Vgef imzfqp fa emk iq oagxp naaw fuowqfe rad ftmf oazoqdf tmbbqzuzs zqjf yazft,254,716200.0
CUST083381,Top-Up Loan,178000,2025-03-27,Pa dvbsk il hdlzvtl pm dl jvbsk nv mvy h oprl pm aol dlhaoly zahfz nvvk,48,214600.0
CUST075747,Business Loan,97000,2024-10-12,Hs vntkc ad fqdzskx zooqdbhzsdc he sgzs xntq bnlldmsr zqd hmbnqonqzsdc hmsn sgd ehmzk udqrhnm ne sgd zfqddldms,214,117400.0
CUST069686,Home Loan,87000,2024-11-17,Aopurpun dl zovbsk dl jvbsk nv mvy h oprl pm aol dlhaoly zahfz nvvk,178,105400.0
CUST069190,Personal Loan,872000,2024-07-05,Xf tipvme bssbohf b nffujoh uibu uif vqebufe qpmjdz hvjefmjoft ibwf cffo ejtusjcvufe up bmm efqbsunfout,313,1047400.0
CUST009077,Auto Loan,599000,2024-09-06,Epno rviozy oj nvt rz xjpgy cvib jpo wt ocz wzvxc wzajmz do bzon xjgyzm vbvdi,250,719800.0
CUST036488,Medical Loan,531000,2025-02-13,Kv jcu dggp yca vqq nqpi ukpeg yg eqwnf jquv c uocnn igv-vqigvjgt cv oa rnceg vjku yggmgpf,90,638200.0
CUST016263,Loan Against Deposit,221000,2024-05-21,Qeb obnrbpqba alzrjbkqp exsb ybbk mobmxoba xka qexq qebob xob kl mbkafkd fqbjp ybclob qeb zilprob lc qefp mexpb,358,266200.0
CUST062500,Auto Loan,808000,2025-01-26,Yg ujqwnf cttcpig c oggvkpi vjcv vjg kpxqkeg fgvcknu ctg eqttgevna tghngevgf kp aqwt tgeqtfu,108,970600.0
CUST039987,Loan Against Deposit,603000,2025-04-16,R fxdum urtn cx rwoxav hxd cqjc juu lxvyurjwln anzdranvnwcb qjen knnw bdllnbboduuh vnc,28,724600.0
CUST028915,Home Loan,805000,2025-02-26,Q iu ezqbqvo bw nwttwe cx bpib bpm qvdwqkm lmbiqta izm kwzzmkbtg zmntmkbml qv gwcz zmkwzla,77,967000.0
CUST098717,Personal Loan,542000,2024-08-28,C qiofx fcey ni chzilg sio nbun siol wiggyhnm uly chwiljilunyx chni nby zchuf pylmcih iz nby ualyygyhn,259,651400.0
CUST026465,Travel Loan,244000,2024-07-28,Bmkl osflwv lg ksq ow ugmdv ljq lzsl fwo harrs hdsuw wnwjqgfw cwwhk jwugeewfvafy,290,293800.0
CUST074600,Personal Loan,366000,2025-01-03,E wi snepejc pk bkhhks ql pdwp pda oydazqhaz peiaheja bkn pda lnkfayp naiwejo qjydwjcaz,131,440200.0
CUST023522,Personal Loan,313000,2024-11-15,Eatpht tchjgt iwpi iwpi ndjg rdbbtcih pgt xcrdgedgpits xcid iwt uxcpa ktghxdc du iwt pvgttbtci,180,376600.0
CUST017890,Personal Loan,497000,2024-10-09,Qy mbiofx ulluhay u gyyncha nbun nby chpicwy xynucfm uly willywnfs lyzfywnyx ch siol lywilxm,217,597400.0
CUST053983,Loan Against Deposit,730000,2025-04-05,V nz jevgvat gb sbyybj hc gung nyy pbzcyvnapr erdhverzragf unir orra fhpprffshyyl zrg,39,877000.0
CUST061663,Business Loan,410000,2024-08-22,Do cvn wzzi rvt ojj gjib ndixz rz xjpgy bmvw ydiizm njhzodhz ocdn rzzf viy xvoxc pk kmjkzmgt,265,493000.0
CUST085740,Travel Loan,248000,2024-11-06,Zwq A osk lzafcafy ow ugmdv tggc laucwlk xgj lzsl ugfuwjl zshhwfafy fwpl egflz,189,298600.0
CUST073866,Travel Loan,264000,2025-04-07,Gejzhu hap ia gjks pdwp whh ykilhewjya namqenaiajpo dwra xaaj oqyyaoobqhhu iap,37,317800.0
CUST076654,Credit Card Loan,108000,2024-10-06,Mx asyph fi kviexpc ettvigmexih mj xlex xli vizmwih gsrxvegx xivqw evi vizmiaih erh eggitxih,220,130600.0
CUST004691,Education Loan,286000,2024-10-27,Ai evi eaemxmrk csyv gsrjmvqexmsr xlex xli ythexih tspmgc kymhipmriw lezi fiir hmwxvmfyxih xs epp hitevxqirxw,199,344200.0
CUST031832,Education Loan,766000,2025-02-13,Vg unf orra jnl gbb ybat fvapr jr pbhyq gel gung arj cvmmn cynpr rirelbar xrrcf erpbzzraqvat,90,920200.0
CUST019066,Medical Loan,862000,2024-08-13,Lt hwdjas pggpcvt p bttixcv iwpi iwt egdytri staxktgpqath pgt hjqbxiits qn iwt jerdbxcv stpsaxct,274,1035400.0
CUST009730,Top-Up Loan,426000,2024-08-24,Zk nflcu sv rnvjfdv zw nv tflcu sffb kztbvkj wfi kyrk tfetvik yrggvezex evok dfeky,263,512200.0
CUST016107,Loan Against Deposit,901000,2025-03-13,Tpiewi irwyvi xlex xlex csyv gsqqirxw evi mrgsvtsvexih mrxs xli jmrep zivwmsr sj xli ekviiqirx,62,1082200.0
CUST022610,Auto Loan,532000,2025-04-05,Nbzcf xf dbo qmbo tpnfuijoh xf dpvme hsbc ejoofs tpnfujnf uijt xffl boe dbudi vq qspqfsmz,39,639400.0
CUST057742,Travel Loan,515000,2024-09-23,Sgzmj xnt enq xntq zssdmshnm sgzs zkk bnlokhzmbd qdpthqdldmsr gzud addm rtbbdrretkkx lds,233,619000.0
CUST021194,Business Loan,815000,2024-10-31,Fbuqiu te dej xuiyjqju je huqsx ekj jxqj jxu kftqjut febyso wkytubydui xqlu ruud tyijhyrkjut je qbb tufqhjcudji,195,979000.0
CUST043808,Education Loan,831000,2024-08-23,Jga K ycu vjkpmkpi yg eqwnf iq hqt c jkmg kh vjg ygcvjgt uvcau iqqf,264,998200.0
CUST038403,Medical Loan,937000,2024-08-22,Xljmp hp nly awly dzxpestyr hp nzfwo slyr zfe mj esp mplns mpqzcp te rped nzwopc lrlty,265,1125400.0
CUST014896,Travel Loan,41000,2025-02-01,Qmfbtf fotvsf uibu uibu bmm dpnqmjbodf sfrvjsfnfout ibwf cffo tvddfttgvmmz nfu,102,50200.0
CUST005385,Auto Loan,907000,2025-02-18,Csy wlsyph hijmrmxipc nsmr ai gsyph lswx e wqepp kix-xskixliv ex qc tpegi xlmw aiioirh,85,1089400.0
CUST042840,Education Loan,536000,2024-10-09,Gwc apwctl lmnqvqbmtg rwqv em kwctl pivo wcb jg bpm jmikp jmnwzm qb omba kwtlmz ioiqv,217,644200.0
CUST066657,Loan Against Deposit,312000,2024-10-31,Olf P dhz aopurpun dl jvbsk nv mvy h oprl pm aol dlhaoly zahfz nvvk,195,375400.0
CUST069495,Medical Loan,358000,2024-11-01,Thfil dl jhu wshu zvtlaopun dl jvbsk ohun vba if aol ilhjo ilmvyl pa nlaz jvskly hnhpu,194,430600.0
CUST025616,Loan Against Deposit,707000,2024-07-21,Ifz J xbt uijoljoh xf dpvme hsbc ejoofs tpnfujnf uijt xffl boe dbudi vq qspqfsmz,297,849400.0
CUST056256,Home Loan,104000,2024-07-02,Fbuqiu te dej xuiyjqju je huqsx ekj jxqj jxuhu qhu de fudtydw yjuci ruvehu jxu sbeikhu ev jxyi fxqiu,316,125800.0
CUST055855,Home Loan,538000,2024-08-05,Domn quhnyx ni mus qy wiofx ai ih u mjihnuhyiom liux nlcj qcnbion gowb jfuhhcha,282,646600.0
CUST094228,Education Loan,624000,2024-06-15,D vh rmdodib oj ajggjr pk ocvo oczmz vmz ij kziydib dozhn wzajmz ocz xgjnpmz ja ocdn kcvnz,333,749800.0
CUST064997,Business Loan,523000,2024-11-27,Znlor jr pna cyna fbzrguvat jr pbhyq unat bhg ol gur ornpu orsber vg trgf pbyqre ntnva,168,628600.0
CUST049713,Medical Loan,352000,2024-10-07,A xafsddq ygl laew lg ow ugmdv zsfy gml tq lzw twsuz twxgjw al ywlk ugdvwj sysaf,219,423400.0
CUST000108,Credit Card Loan,297000,2025-03-31,Ck ykxouayre tkkj zu ck iuarj yzgxz cuxqotm ut zngz vxupkiz ojkg ck puqkj ghuaz kgxrokx,44,357400.0
CUST064093,Education Loan,958000,2024-05-16,Zk nflcu sv rnvjfdv zw nv tflcu xirs uzeevi jfdvkzdv kyzj nvvb reu trkty lg gifgvicp,363,1150600.0
CUST083992,Travel Loan,988000,2025-02-02,Fbuqiu te dej xuiyjqju je huqsx ekj jxqj jxu fhezusj tubyluhqrbui qhu ikrcyjjut ro jxu kfsecydw tuqtbydu,101,1186600.0
CUST050924,Education Loan,675000,2024-11-10,Iye cryevn nopsxsdovi tysx go myevn mromu yed drkd xog wyfso iye woxdsyxon vkcd wyxdr,185,811000.0
CUST030237,Home Loan,396000,2024-12-09,Sd rkc loox gki dyy vyxq csxmo go myevn mromu yed drkd xog wyfso iye woxdsyxon vkcd wyxdr,156,476200.0
CUST022922,Travel Loan,320000,2025-04-08,X uxcpaan vdi ixbt id lt rdjas wpcv dji qn iwt qtprw qtudgt xi vtih rdastg pvpxc,36,385000.0
CUST002668,Top-Up Loan,618000,2024-09-07,Cyrnfr qb abg urfvgngr gb ernpu bhg gung gur hcqngrq cbyvpl thvqryvarf unir orra qvfgevohgrq gb nyy qrcnegzragf,249,742600.0
CUST028310,Loan Against Deposit,972000,2025-01-07,Rfyli wms dmp wmsp yrrclrgml rfyr rfc gltmgac bcrygjq ypc amppcarjw pcdjcarcb gl wmsp pcampbq,127,1167400.0
CUST084564,Credit Card Loan,461000,2025-02-16,Ftq dqcgqefqp paogyqzfe tmhq nqqz bdqbmdqp mzp ftmf ftq gbpmfqp baxuok sgupqxuzqe tmhq nqqz puefdungfqp fa mxx pqbmdfyqzfe,87,554200.0
CUST048947,Education Loan,146000,2024-11-14,Aydtbo buj cu adem jxqj jxu ydleysu tujqybi qhu sehhusjbo huvbusjut yd oekh husehti,181,176200.0
CUST085094,Loan Against Deposit,899000,2025-01-05,Xi wph qttc lpn idd adcv hxcrt lt rdjas vd dc p hedcipctdjh gdps igxe lxiwdji bjrw eapccxcv,129,1079800.0
CUST062377,Travel Loan,551000,2025-02-20,Al zsk twwf osq lgg dgfy kafuw ow ugmdv klsjl ogjcafy gf lzsl hjgbwul avws ow bgcwv stgml wsjdawj,83,662200.0
CUST069878,Education Loan,843000,2024-08-19,Mci gvcizr rstwbwhszm xcwb ks qcizr pccy hwqyshg tcf hvoh qcbqsfh voddsbwbu bslh acbhv,268,1012600.0
CUST000811,Home Loan,607000,2024-08-28,Hdwskw wfkmjw lzsl lzsl lzw hjgbwul vwdanwjstdwk sjw kmteallwv tq lzw mhugeafy vwsvdafw,259,729400.0
CUST054979,Travel Loan,113000,2024-06-09,Qb ewctl jm ozmibtg ixxzmkqibml qn bpib em uiqvbiqv wxmv kwuucvqkibqwv lczqvo bpm quxtmumvbibqwv xmzqwl,339,136600.0
CUST013686,Loan Against Deposit,40000,2025-02-01,Zngtq eua lux euax gzzktzout zngz znk otbuoik jkzgory gxk iuxxkizre xklrkizkj ot euax xkiuxjy,102,49000.0
CUST012959,Business Loan,426000,2024-10-06,Hs gzr addm vzx snn knmf rhmbd vd bntkc fn nm z ronmszmdntr qnzc sqho vhsgnts ltbg okzmmhmf,220,512200.0
CUST041667,Business Loan,283000,2024-07-09,Esp cpbfpdepo oznfxpyed slgp mppy acpalcpo lyo esle esp cpgtdpo nzyeclne epcxd lcp cpgtphpo lyo lnnpaepo,309,340600.0
CUST097483,Education Loan,510000,2024-10-25,Qb ewctl jm iemawum qn em kwctl ow nwz i pqsm qn bpm emibpmz abiga owwl,201,613000.0
CUST020679,Personal Loan,562000,2024-08-15,Iwpcz ndj udg ndjg piitcixdc iwpi iwt hrwtsjats ixbtaxct udg iwt egdytri gtbpxch jcrwpcvts,272,675400.0
CUST001101,Loan Against Deposit,807000,2024-12-21,F xj tofqfkd ql cliilt rm qexq qeb rmaxqba mlifzv drfabifkbp exsb ybbk afpqofyrqba ql xii abmxoqjbkqp,144,969400.0
CUST009887,Credit Card Loan,882000,2024-06-25,Vtyowj wpe xp vyzh esle lww nzxawtlynp cpbftcpxpyed slgp mppy dfnnpddqfwwj xpe,323,1059400.0
CUST059570,Personal Loan,586000,2024-06-02,Ocdifdib rz ncjpgy rz xjpgy omt ocvo izr kduuv kgvxz zqzmtjiz fzzkn mzxjhhziydib,346,704200.0
CUST023665,Medical Loan,781000,2025-04-13,Bm phnew ux zkxtmer tiikxvbtmxw by matm max ikhcxvm wxeboxktuexl tkx lnufbmmxw ur max nivhfbgz wxtwebgx,31,938200.0
CUST079399,Personal Loan,366000,2024-12-04,J bn xsjujoh up gpmmpx vq uibu uif tdifevmfe ujnfmjof gps uif qspkfdu sfnbjot vodibohfe,161,440200.0
CUST030719,Loan Against Deposit,327000,2024-11-14,Brx vkrxog ghilqlwhob mrlq zh frxog vwduw zrunlqj rq wkdw surmhfw lghd zh mrnhg derxw hduolhu,181,393400.0
CUST012668,Home Loan,546000,2025-01-04,Jzf dszfwo opqtytepwj uzty hp nzfwo dapyo l wlkj Dfyolj ufde mtyrp-hlenstyr zwo dszhd,130,656200.0
CUST098471,Loan Against Deposit,548000,2024-09-29,Ywbrzm zsh as ybck hvoh ks aowbhowb cdsb qcaaibwqohwcb rifwbu hvs wadzsasbhohwcb dsfwcr,227,658600.0
CUST010602,Top-Up Loan,455000,2025-03-11,Te sld mppy hlj ezz wzyr dtynp hp nzfwo ecj esle yph atkkl awlnp pgpcjzyp vppad cpnzxxpyotyr,64,547000.0
CUST019910,Travel Loan,469000,2024-05-06,Drpsv nv tre gcre jfdvkyzex nv tflcu sffb kztbvkj wfi kyrk tfetvik yrggvezex evok dfeky,373,677560.0
CUST087657,Medical Loan,150000,2024-08-02,Gwc apwctl lmnqvqbmtg rwqv em kwctl pivo wcb jg bpm jmikp jmnwzm qb omba kwtlmz ioiqv,285,181000.0
CUST004553,Loan Against Deposit,64000,2024-08-03,Czt D rvn ocdifdib rz xjpgy nkziy v gvut Npiyvt epno wdibz-rvoxcdib jgy ncjrn,284,77800.0
CUST091801,Top-Up Loan,352000,2024-08-22,S psxkvvi qyd dswo dy go myevn qbkl nsxxob cywodswo drsc goou kxn mkdmr ez zbyzobvi,265,423400.0
CUST057762,Top-Up Loan,986000,2024-12-20,A se ojalafy lg xgddgo mh lzsl lzw hjgbwul vwdanwjstdwk sjw kmteallwv tq lzw mhugeafy vwsvdafw,145,1184200.0
CUST081571,Medical Loan,344000,2024-09-02,Iwt gtfjthits sdrjbtcih wpkt qttc egtepgts pcs iwpi paa rdbeaxpcrt gtfjxgtbtcih wpkt qttc hjrrthhujaan bti,254,413800.0
CUST045997,Home Loan,669000,2025-02-14,Tecd gkxdon dy cki go myevn lyyu dsmuodc pyb drkd myxmobd rkzzoxsxq xohd wyxdr,89,803800.0
CUST009643,Education Loan,113000,2024-10-14,E skqhz hega pk ejbkni ukq pdwp pda qlzwpaz lkheyu cqezahejao dwra xaaj zeopnexqpaz pk whh zalwnpiajpo,212,136600.0
CUST004188,Auto Loan,131000,2024-05-22,Sdbc fjwcnm cx bjh fn lxdum kxxt crltncb oxa cqjc lxwlnac qjyynwrwp wngc vxwcq,357,158200.0
CUST033738,Home Loan,616000,2024-10-16,Iwt gtfjthits sdrjbtcih wpkt qttc egtepgts pcs iwpi ndjg kpajpqat uttsqprz xh hwpgts lxiw iwt qgdpstg bpcpvtbtci itpb,210,740200.0
CUST055104,Loan Against Deposit,648000,2024-04-23,Ck ynuarj gxxgtmk g skkzotm zngz euax bgraghrk lkkjhgiq oy yngxkj cozn znk hxugjkx sgtgmksktz zkgs,386,935320.0
CUST056122,Business Loan,460000,2025-01-28,D adivggt bjo odhz oj rz xjpgy bj ji v nkjiovizjpn mjvy omdk rdocjpo hpxc kgviidib,106,553000.0
CUST001654,Home Loan,944000,2024-05-30,Iwt gtfjthits sdrjbtcih wpkt qttc egtepgts pcs iwpi paa rdbeaxpcrt gtfjxgtbtcih wpkt qttc hjrrthhujaan bti,349,1133800.0
CUST003363,Top-Up Loan,988000,2025-01-28,Gunax lbh sbe lbhe nggragvba gung gur fpurqhyrq gvzryvar sbe gur cebwrpg erznvaf hapunatrq,106,1186600.0
CUST097418,Auto Loan,99000,2025-02-15,Xli viuyiwxih hsgyqirxw lezi fiir tvitevih erh xlex csyv gsqqirxw evi mrgsvtsvexih mrxs xli jmrep zivwmsr sj xli ekviiqirx,88,119800.0
CUST086308,Education Loan,41000,2024-06-25,Tjp ncjpgy yzadidozgt ejdi rz xjpgy bj ajm v cdfz da ocz rzvoczm novtn bjjy,323,50200.0
CUST032632,Travel Loan,116000,2024-09-11,Matgd rhn yhk rhnk tmmxgmbhg matm max lvaxwnexw mbfxebgx yhk max ikhcxvm kxftbgl ngvatgzxw,245,140200.0
CUST006672,Auto Loan,105000,2024-04-25,Hs vntkc ad zvdrnld he vd bntkc rodmc z kzyx Rtmczx itrs ahmfd-vzsbghmf nkc rgnvr,384,153400.0
CUST011039,Loan Against Deposit,885000,2025-03-04,Gcvrjv uf efk yvjzkrkv kf ivrty flk kyrk pfli tfddvekj riv zetfigfirkvu zekf kyv wzerc mvijzfe fw kyv rxivvdvek,71,1063000.0
CUST077313,Medical Loan,547000,2024-12-28,Cqrwtrwp fn bqxdum fn lxdum bcjac fxatrwp xw cqjc yaxsnlc rmnj fn sxtnm jkxdc njaurna,137,657400.0
CUST055978,Personal Loan,576000,2024-11-06,Wh vog pssb kom hcc zcbu gwbqs ks qcizr ghofh kcfywbu cb hvoh dfcxsqh wrso ks xcysr opcih sofzwsf,189,692200.0
CUST080091,Home Loan,370000,2024-11-23,Aydtbo buj cu adem jxqj mu cqydjqyd efud secckdysqjyed tkhydw jxu ycfbucudjqjyed fuhyet,172,445000.0
CUST023248,Top-Up Loan,137000,2024-10-10,W twbozzm uch hwas hc ks qcizr uc cb o gdcbhobscig fcor hfwd kwhvcih aiqv dzobbwbu,216,165400.0
CUST080520,Top-Up Loan,918000,2024-11-21,Thfil dl jhu wshu zvtlaopun dl jvbsk nv mvy h oprl pm aol dlhaoly zahfz nvvk,174,1102600.0
CUST039792,Medical Loan,411000,2024-05-04,Cqoru mu sqd fbqd iecujxydw mu sekbt we veh q xyau yv jxu muqjxuh ijqoi weet,375,594040.0
CUST013992,Credit Card Loan,819000,2025-01-04,Yg ctg cyckvkpi aqwt eqphktocvkqp vjcv aqwt xcnwcdng hggfdcem ku ujctgf ykvj vjg dtqcfgt ocpcigogpv vgco,130,983800.0
CUST095717,Medical Loan,66000,2024-09-04,Zk nflcu sv rnvjfdv zw nv tflcu xirs uzeevi jfdvkzdv kyzj nvvb reu trkty lg gifgvicp,252,80200.0
CUST065833,Travel Loan,628000,2024-12-31,Xlmromrk ai wlsyph ai gsyph fsso xmgoixw jsv xlex gsrgivx lettirmrk ribx qsrxl,134,754600.0
CUST081559,Credit Card Loan,241000,2024-06-23,Hxd bqxdum mnorwrcnuh sxrw fn lxdum kxxt crltncb oxa cqjc lxwlnac qjyynwrwp wngc vxwcq,325,290200.0
CUST001776,Personal Loan,679000,2025-02-13,C ug qlcncha ni ziffiq oj nbun qy guchnuch ijyh wiggohcwuncih xolcha nby cgjfygyhnuncih jylcix,90,815800.0
CUST060593,Education Loan,211000,2025-04-22,Ocvif tjp ajm tjpm vooziodji ocvo vgg xjhkgdvixz mzlpdmzhzion cvqz wzzi npxxznnapggt hzo,22,254200.0
CUST019598,Medical Loan,984000,2025-01-28,Rc fxdum kn jfnbxvn ro fn lxdum lqnlt xdc cqjc wnf vxern hxd vnwcrxwnm ujbc vxwcq,106,1181800.0
CUST070779,Travel Loan,963000,2025-01-11,Vlr pelria abcfkfqbiv glfk tb zlria exkd lrq yv qeb ybxze ybclob fq dbqp zliabo xdxfk,123,1156600.0
CUST096999,Credit Card Loan,878000,2025-03-20,Xtmiam mvaczm bpib bpib bpm zmdqaml kwvbzikb bmzua izm zmdqmeml ivl ikkmxbml,55,1054600.0
CUST087279,Medical Loan,849000,2024-07-23,Y mekbt byau je ydvehc oek jxqj jxu fhezusj tubyluhqrbui qhu ikrcyjjut ro jxu kfsecydw tuqtbydu,295,1019800.0
CUST012726,Travel Loan,419000,2024-09-16,Wkilo go mkx zvkx cywodrsxq go myevn mromu yed drkd xog wyfso iye woxdsyxon vkcd wyxdr,240,503800.0
CUST091593,Personal Loan,328000,2024-06-12,J bn xsjujoh up gpmmpx vq uibu uif sfwjtfe dpousbdu ufsnt bsf sfwjfxfe boe bddfqufe,336,394600.0
CUST042722,Travel Loan,295000,2024-08-31,X pb lgxixcv id udaadl je iwpi lt bpxcipxc detc rdbbjcxrpixdc sjgxcv iwt xbeatbtcipixdc etgxds,256,355000.0
CUST095071,Medical Loan,922000,2025-02-28,T hzfwo wtvp ez tyqzcx jzf esle esp cpgtdpo nzyeclne epcxd lcp cpgtphpo lyo lnnpaepo,75,1107400.0
CUST079703,Home Loan,516000,2024-06-30,Yg ujqwnf cttcpig c oggvkpi vjcv aqwt xcnwcdng hggfdcem ku ujctgf ykvj vjg dtqcfgt ocpcigogpv vgco,318,620200.0
CUST091322,Loan Against Deposit,597000,2024-09-22,Payz cgtzkj zu yge ck iuarj zxe zngz tkc voffg vrgik kbkxeutk qkkvy xkiussktjotm,234,717400.0
CUST075680,Personal Loan,90000,2024-08-17,Xf tfsjpvtmz offe up xf dpvme tqfoe b mbaz Tvoebz kvtu cjohf-xbudijoh pme tipxt,270,109000.0
CUST039429,Loan Against Deposit,808000,2024-06-28,Jzf dszfwo opqtytepwj uzty hp nzfwo rclm otyypc dzxpetxp estd hppv lyo nlens fa aczapcwj,320,970600.0
CUST056905,Education Loan,80000,2024-07-06,Wms qfmsjb bcdglgrcjw hmgl uc amsjb qrypr umpigle ml rfyr npmhcar gbcy uc hmicb yzmsr cypjgcp,312,97000.0
CUST028586,Auto Loan,782000,2024-09-11,Te hzfwo mp rcplewj laacpntlepo tq esle esp aczupne opwtgpclmwpd lcp dfmxteepo mj esp fanzxtyr oplowtyp,245,939400.0
CUST066041,Loan Against Deposit,137000,2024-06-17,Uqjfxj jsxzwj ymfy ymfy ymj nsatnhj ijyfnqx fwj htwwjhyqd wjkqjhyji ns dtzw wjhtwix,331,165400.0
CUST073623,Top-Up Loan,411000,2024-05-05,Axr B ptl mabgdbgz px vhnew uhhd mbvdxml yhk matm vhgvxkm atiixgbgz gxqm fhgma,374,594040.0
CUST048581,Medical Loan,34000,2024-08-14,Trwmuh unc vn twxf cqjc hxda ejudjkun onnmkjlt rb bqjanm frcq cqn kaxjmna vjwjpnvnwc cnjv,273,41800.0
CUST089068,Credit Card Loan,376000,2024-08-31,Gcvrjv uf efk yvjzkrkv kf ivrty flk kyrk kyv lgurkvu gfcztp xlzuvczevj yrmv svve uzjkizslkvu kf rcc uvgrikdvekj,256,452200.0
CUST023608,Medical Loan,610000,2025-04-23,J xpvme mjlf up jogpsn zpv uibu uif vqebufe qpmjdz hvjefmjoft ibwf cffo ejtusjcvufe up bmm efqbsunfout,21,733000.0
CUST051955,Travel Loan,115000,2024-08-20,Pfl jyflcu uvwzezkvcp afze nv tflcu yrex flk sp kyv svrty svwfiv zk xvkj tfcuvi rxrze,267,139000.0
CUST012452,Auto Loan,506000,2025-03-15,J gjobmmz hpu ujnf up xf dpvme iptu b tnbmm hfu-uphfuifs bu nz qmbdf uijt xfflfoe,60,608200.0
CUST020255,Top-Up Loan,715000,2025-03-03,Ju xpvme cf bxftpnf jg xf dpvme hp po b tqpoubofpvt spbe usjq xjuipvu nvdi qmboojoh,72,859000.0
CUST088676,Home Loan,814000,2024-06-07,Jxvyb tb zxk mixk pljbqefkd tb zlria dl clo x efhb fc qeb tbxqebo pqxvp dlla,341,977800.0
